,Наименование,id,Скидка,Цена,Цена со скидкой,Бренд,id бренда,feedbacks,rating,Ссылка
630,"""Гимнастика для ума 6-7 лет"" + ""Фитнес для ума 6-7 лет""",120770468,60,2473,989,Домашняя школа 6-9,893873,8,5,https://www.wildberries.ru/catalog/120770468/detail.aspx?targetUrl=BP
631,Набор книг Балийские сказки для детей подарок на новый год,138528767,66,2690,914,издательство Бадабум,2686116,7,5,https://www.wildberries.ru/catalog/138528767/detail.aspx?targetUrl=BP
632,Путешествия и открытия. Полная энциклоп,124634161,30,1632,1142,Эксмо,4481,0,0,https://www.wildberries.ru/catalog/124634161/detail.aspx?targetUrl=BP
633,Сказки Эльбы,16154576,34,1330,877,Эксмо,4481,4,4,https://www.wildberries.ru/catalog/16154576/detail.aspx?targetUrl=BP
634,Все сказки Пушкина,1577795,15,682,579,РОСМЭН,2613,398,5,https://www.wildberries.ru/catalog/1577795/detail.aspx?targetUrl=BP
635,Музыкальная книга детям Волшебная флейта,57943934,67,7756,2559,МОЗАИКА kids,46666,220,4,https://www.wildberries.ru/catalog/57943934/detail.aspx?targetUrl=BP
636,Набор книг Minecraft Для строителей,43804977,34,1941,1281,Minecraft,4224,22,5,https://www.wildberries.ru/catalog/43804977/detail.aspx?targetUrl=BP
637,Реши-Пиши Легкое умножение Полный курс,110429897,90,9810,981,Банда Умников,8804,34,5,https://www.wildberries.ru/catalog/110429897/detail.aspx?targetUrl=BP
638,Интерактивная сказка. Набор из 4 книг,73483038,82,9922,1785,МОЗАИКА kids,46666,5,5,https://www.wildberries.ru/catalog/73483038/detail.aspx?targetUrl=BP
639,Тренажер Таблица умножения за 3 дня Обучающие карточки,14856688,82,4934,888,КАПИТАЛ,18716,215,4,https://www.wildberries.ru/catalog/14856688/detail.aspx?targetUrl=BP
640,Развивающие карточки Звукоподражание Ламинированные,47400446,54,1520,699,Cards_for_kids77,648440,125,5,https://www.wildberries.ru/catalog/47400446/detail.aspx?targetUrl=BP
641,Давай клеить! Вкусные задания. KUMON,5720293,23,838,645,"Издательство Манн, Иванов и Фербер",4508,5,5,https://www.wildberries.ru/catalog/5720293/detail.aspx?targetUrl=BP
642,Гарри Поттер. Фантастические существа,28002885,31,6023,4155,Издательство Росмэн,398767,1,5,https://www.wildberries.ru/catalog/28002885/detail.aspx?targetUrl=BP
643,"Подготовка к школе, 5-7 лет",26817473,90,13900,1390,Банда Умников,8804,47,5,https://www.wildberries.ru/catalog/26817473/detail.aspx?targetUrl=BP
644,"Книга Домашний текстиль Шторы, подушки, скатерти",137618790,40,2000,1200,Эксмо,4481,0,0,https://www.wildberries.ru/catalog/137618790/detail.aspx?targetUrl=BP
645,Как устроен Город. От водопровода до транспорта 6+,7520897,37,1110,699,ПИТЕР,6412,29,5,https://www.wildberries.ru/catalog/7520897/detail.aspx?targetUrl=BP
646,Как устроен РОБОТ?,12298950,37,1110,699,ПИТЕР,6412,5,5,https://www.wildberries.ru/catalog/12298950/detail.aspx?targetUrl=BP
647,Путь художника. Рабочая тетрадь,68616951,10,863,776,Livebook,14309,2,5,https://www.wildberries.ru/catalog/68616951/detail.aspx?targetUrl=BP
648,Набор Скорочтение для детей 6 - 9 лет,120710349,60,4995,1998,Домашняя школа 6-9,893873,8,5,https://www.wildberries.ru/catalog/120710349/detail.aspx?targetUrl=BP
649,Тайм-менеджмент Развивающие карточки-тренажер для детей,39633543,90,6900,690,BRAINY TRAINY,44153,55,5,https://www.wildberries.ru/catalog/39633543/detail.aspx?targetUrl=BP
650,Набор книг для малышей .Полный годовой курс 1+ (12 книг),134618263,56,3372,1483,ШКОЛА СЕМИ ГНОМОВ,25758,26,5,https://www.wildberries.ru/catalog/134618263/detail.aspx?targetUrl=BP
651,"Игра ""Стартап-конструктор"" Бизнес-игра",9285370,90,9300,930,Банда Умников,8804,42,5,https://www.wildberries.ru/catalog/9285370/detail.aspx?targetUrl=BP
652,Набор книг для легкого старта 3+,50844834,84,6464,1034,ШКОЛА СЕМИ ГНОМОВ,25758,6,5,https://www.wildberries.ru/catalog/50844834/detail.aspx?targetUrl=BP
653,Книги для детей годовой курс занятий активити мастерские 4+,115929843,67,9280,3062,ШКОЛА СЕМИ ГНОМОВ,25758,420,5,https://www.wildberries.ru/catalog/115929843/detail.aspx?targetUrl=BP
654,Школа пластилина Развитие мелкой моторики и речи Ахмадуллин,140651497,60,2370,948,ИД НЕВА,219394,1,5,https://www.wildberries.ru/catalog/140651497/detail.aspx?targetUrl=BP
655,Скорочтение для детей 6-9 л.+ Гимнастика для ума 6-7 л,120706413,60,2473,989,Домашняя школа 6-9,893873,10,4,https://www.wildberries.ru/catalog/120706413/detail.aspx?targetUrl=BP
656,Детские книги для малышей с окошками. Набор из 4 штук,137512171,72,2999,839,БимБиМон,313263,289,5,https://www.wildberries.ru/catalog/137512171/detail.aspx?targetUrl=BP
657,Кулинарная книга для детей и подростков,123059090,75,2500,625,Умный Ребёнок,162833,8,5,https://www.wildberries.ru/catalog/123059090/detail.aspx?targetUrl=BP
658,Набор тетрадей Реши-Пиши Учимся читать. Полный курс,117753043,90,7900,790,Банда Умников,8804,22,5,https://www.wildberries.ru/catalog/117753043/detail.aspx?targetUrl=BP
659,Книга Ninjago - Дар Судьбы. Книга Приключений,49439278,10,2349,2114,LEGO,1241,15,5,https://www.wildberries.ru/catalog/49439278/detail.aspx?targetUrl=BP
660,Природа вокруг нас Растения и Деревья (2 книги в 1,13864288,17,1369,1136,"Издательство Манн, Иванов и Фербер",4508,4,4,https://www.wildberries.ru/catalog/13864288/detail.aspx?targetUrl=BP
661,Большая сказочная серия. Большая книга сонных сказок Читаем…,46244394,50,1710,855,Издательство CLEVER,4623,61,5,https://www.wildberries.ru/catalog/46244394/detail.aspx?targetUrl=BP
662,"""Скоросчет для детей 7-10 лет.""+""Скорочтение от 6 до 9 лет.""",120772017,60,2473,989,Домашняя школа 6-9,893873,4,3,https://www.wildberries.ru/catalog/120772017/detail.aspx?targetUrl=BP
663,Развивающие тетради книги пиши-стирай,126619161,53,1399,657,Igrulex,291570,251,5,https://www.wildberries.ru/catalog/126619161/detail.aspx?targetUrl=BP
664,Ваш малыш. Шаг за шагом. Помесячный план развития 2+,36566350,68,2775,888,Филипок и Ко,51143,41,5,https://www.wildberries.ru/catalog/36566350/detail.aspx?targetUrl=BP
665,Музыкальная книга Птицы в музыке классиков,30932619,46,2200,1188,VoiceBook,21935,101,4,https://www.wildberries.ru/catalog/30932619/detail.aspx?targetUrl=BP
666,Финансовый ликбез для детей и родителей,60709373,62,1658,630,Домашняя школа 10-14,885846,27,5,https://www.wildberries.ru/catalog/60709373/detail.aspx?targetUrl=BP
667,Музыкальная книга для детей Семь Великих Композиторов,10091626,46,2200,1188,VoiceBook,21935,101,4,https://www.wildberries.ru/catalog/10091626/detail.aspx?targetUrl=BP
668,Остров Сокровищ. Книга-панорама,39087622,35,7280,4732,Лабиринт,67408,12,4,https://www.wildberries.ru/catalog/39087622/detail.aspx?targetUrl=BP
669,"Картина из пайеток ""Единорог""",71369928,34,906,597,LORI,9308,4,5,https://www.wildberries.ru/catalog/71369928/detail.aspx?targetUrl=BP
670,Комплект Ваш малыш 0+ Бэби-тренажер Шамиль Ахмадуллин,22067870,92,12275,982,Брокколька,164907,123,4,https://www.wildberries.ru/catalog/22067870/detail.aspx?targetUrl=BP
671,Набор книг для малышей.Полный годовой курс 2+ (12 книг),134622271,56,3372,1483,ШКОЛА СЕМИ ГНОМОВ,25758,26,5,https://www.wildberries.ru/catalog/134622271/detail.aspx?targetUrl=BP
672,Ярошторм. Экспедиция над облаками,16310577,15,1544,1312,"Издательство Манн, Иванов и Фербер",4508,0,0,https://www.wildberries.ru/catalog/16310577/detail.aspx?targetUrl=BP
673,набор развивающих книг для ребенка,130308894,50,1918,959,Кидстартер,441402,0,0,https://www.wildberries.ru/catalog/130308894/detail.aspx?targetUrl=BP
674,Подарочный набор. Магниты из гипса,68181744,41,994,586,LORI,9308,2,5,https://www.wildberries.ru/catalog/68181744/detail.aspx?targetUrl=BP
675,"Мой первый год. Альбом про то, как я расту",113779026,10,2928,2635,Эксмо,4481,0,0,https://www.wildberries.ru/catalog/113779026/detail.aspx?targetUrl=BP
676,Музыкальная книга Азбука в стихах,143038924,0,1800,1800,Toys1more,2756685,0,0,https://www.wildberries.ru/catalog/143038924/detail.aspx?targetUrl=BP
677,Детектив Пьер распутывает дело. Погоня в Башне лабиринтов,68583576,10,1853,1667,"Издательство Манн, Иванов и Фербер",4508,0,0,https://www.wildberries.ru/catalog/68583576/detail.aspx?targetUrl=BP
678,На ферме,71778747,15,1952,1659,Эксмо,4481,0,0,https://www.wildberries.ru/catalog/71778747/detail.aspx?targetUrl=BP
679,Шахматы в начальной школе второй год обучения,71687521,10,1032,928,Издательство АСТ,5971,0,0,https://www.wildberries.ru/catalog/71687521/detail.aspx?targetUrl=BP
680,Утраченная лёгкость,24849967,29,1244,883,ИД Городец,17074,2,5,https://www.wildberries.ru/catalog/24849967/detail.aspx?targetUrl=BP
681,"Первая книга малыша. Стихи, сказки",39813094,5,863,819,Издательство АСТ,5971,0,0,https://www.wildberries.ru/catalog/39813094/detail.aspx?targetUrl=BP
682,Театр сказок Шарля Перро,74681482,10,936,842,Рипол-Классик,5661,0,0,https://www.wildberries.ru/catalog/74681482/detail.aspx?targetUrl=BP
683,Три кота. 250 наклеек. Времена года,51186460,30,928,649,МОЗАИКА kids,46666,0,0,https://www.wildberries.ru/catalog/51186460/detail.aspx?targetUrl=BP
684,Настольные игры для всей семьи - Игра в ассоциации,40448115,31,916,632,издательство ранок,81706,2,5,https://www.wildberries.ru/catalog/40448115/detail.aspx?targetUrl=BP
685,Лучший подарок почемучке (4 книги),12051046,84,3856,616,Владис,5662,6,4,https://www.wildberries.ru/catalog/12051046/detail.aspx?targetUrl=BP
686,"Ты сильнее, чем ты думаешь. Гид по твоей самооценке",5939453,20,1126,900,"Издательство Манн, Иванов и Фербер",4508,62,5,https://www.wildberries.ru/catalog/5939453/detail.aspx?targetUrl=BP
687,Каллиграфические прописи. Комплект,63041884,55,2040,918,Станюк Т.Ю.,231422,9,5,https://www.wildberries.ru/catalog/63041884/detail.aspx?targetUrl=BP
688,Набор книг для детей.Полный годовой курс 4+ (12 книг),134630421,56,3372,1483,ШКОЛА СЕМИ ГНОМОВ,25758,26,5,https://www.wildberries.ru/catalog/134630421/detail.aspx?targetUrl=BP
689,Нескучная география с Жюлем Верном по следам капитана Гранта,7829869,42,2412,1398,Белый Город / Воскресный день,1505208,44,5,https://www.wildberries.ru/catalog/7829869/detail.aspx?targetUrl=BP
690,Прописи для дошкольников многоразовые,78204945,51,3000,1470,Glabika books,20533804,151,4,https://www.wildberries.ru/catalog/78204945/detail.aspx?targetUrl=BP
691,Комплект из 4-х детских книг А.Курпатова,123131974,60,3800,1520,Филипок и Ко,51143,1,5,https://www.wildberries.ru/catalog/123131974/detail.aspx?targetUrl=BP
692,Соображалки2в1. Развивающие игры на логику и воображение 3+,3710475,59,2057,843,Умница,3078,334,5,https://www.wildberries.ru/catalog/3710475/detail.aspx?targetUrl=BP
693,Магия вязания спицами. Возвращение в Хогвартс новая,132357332,43,3346,1907,"Издательство Манн, Иванов и Фербер",4508,3,4,https://www.wildberries.ru/catalog/132357332/detail.aspx?targetUrl=BP
694,Набор книг для легкого старта 4+,50844836,84,6464,1034,ШКОЛА СЕМИ ГНОМОВ,25758,1,5,https://www.wildberries.ru/catalog/50844836/detail.aspx?targetUrl=BP
695,Развиваем мозг ребенка. Пластилин,122861980,60,1720,688,Домашняя школа 3-6,909203,1,5,https://www.wildberries.ru/catalog/122861980/detail.aspx?targetUrl=BP
696,Скорочтение для детей 10-16 л.+Карта тела 11-15 комплект,120654669,60,2423,969,Домашняя школа 10-14,885846,0,0,https://www.wildberries.ru/catalog/120654669/detail.aspx?targetUrl=BP
697,Большая энциклопедия оружия и военной техники,16849761,76,3534,848,Владис,5662,93,5,https://www.wildberries.ru/catalog/16849761/detail.aspx?targetUrl=BP
698,Набор из 6 книг с окошками и загадками для детей.Развитие 3+,123753352,77,6354,1461,МОЗАИКА kids,46666,0,0,https://www.wildberries.ru/catalog/123753352/detail.aspx?targetUrl=BP
699,Скорочтение 6-9 + Гимнастика для ума 8-9,120722116,60,2473,989,Домашняя школа 6-9,893873,3,5,https://www.wildberries.ru/catalog/120722116/detail.aspx?targetUrl=BP
700,"Музыкальная книга для детей, развитие для малышей 0+",7521300,67,3101,1023,Малышарики,10212,188,4,https://www.wildberries.ru/catalog/7521300/detail.aspx?targetUrl=BP
701,Секреты пластилина,2263741,40,1019,611,Издательство Махаон,6301,831,5,https://www.wildberries.ru/catalog/2263741/detail.aspx?targetUrl=BP
702,Книги для детей подарки детям настольные игры,122199741,63,2490,921,Brainy Bunny,46542,6,5,https://www.wildberries.ru/catalog/122199741/detail.aspx?targetUrl=BP
703,Книга-квест доп.реальность Сказочный патруль Пять королевств,33317135,44,1625,910,DEVAR,8890,87,5,https://www.wildberries.ru/catalog/33317135/detail.aspx?targetUrl=BP
704,Набор книги для детей малышей годовой курс занятий 4+,115940563,72,5410,1514,ШКОЛА СЕМИ ГНОМОВ,25758,39,5,https://www.wildberries.ru/catalog/115940563/detail.aspx?targetUrl=BP
705,Русская роспись. Наина Величко,4137418,35,2800,1820,Хоббитека,8101,29,5,https://www.wildberries.ru/catalog/4137418/detail.aspx?targetUrl=BP
706,Блокнот-тренажер Гимнастика для ума для детей 8-9 лет,18405399,69,1984,615,КАПИТАЛ,18716,55,5,https://www.wildberries.ru/catalog/18405399/detail.aspx?targetUrl=BP
707,Школа пластилина Развитие мелкой моторики и речи Ахмадуллин,140651565,60,2370,948,Школа раннего развития 0-3,868362,0,0,https://www.wildberries.ru/catalog/140651565/detail.aspx?targetUrl=BP
708,Набор 5 книг мастерские для творчества,100103398,67,1850,610,ШКОЛА СЕМИ ГНОМОВ,25758,46,5,https://www.wildberries.ru/catalog/100103398/detail.aspx?targetUrl=BP
709,Набор 6 книг активити. Монтессори,78479047,79,5717,1200,МОЗАИКА kids,46666,0,0,https://www.wildberries.ru/catalog/78479047/detail.aspx?targetUrl=BP
710,Монеты России. Исторический каталог отечественного,65091554,40,2316,1389,Эксмо,4481,1,4,https://www.wildberries.ru/catalog/65091554/detail.aspx?targetUrl=BP
711,Набор 4 книги для малышей с пазлами,74980498,79,4153,872,МОЗАИКА kids,46666,24,5,https://www.wildberries.ru/catalog/74980498/detail.aspx?targetUrl=BP
712,Набор развивающих книг для детей от 7лет,64901385,63,1800,666,Умный Ребёнок,162833,16,5,https://www.wildberries.ru/catalog/64901385/detail.aspx?targetUrl=BP
713,Гигантская книга Найди и покажи. Животные Книжка раскладушка…,43368736,70,2320,696,Издательство CLEVER,4623,35,5,https://www.wildberries.ru/catalog/43368736/detail.aspx?targetUrl=BP
714,Набор книг для легкого старта 0+,50844829,85,6464,969,ШКОЛА СЕМИ ГНОМОВ,25758,8,5,https://www.wildberries.ru/catalog/50844829/detail.aspx?targetUrl=BP
715,Набор Искатели приключений,43805301,36,1998,1278,Minecraft,4224,30,5,https://www.wildberries.ru/catalog/43805301/detail.aspx?targetUrl=BP
716,Как тренировать память у детей 7-10 лет,123748672,60,1723,689,КАПИТАЛ,18716,0,0,https://www.wildberries.ru/catalog/123748672/detail.aspx?targetUrl=BP
717,№9 -- Балет (набор),59352168,31,2605,1797,издательство ранок,81706,1,5,https://www.wildberries.ru/catalog/59352168/detail.aspx?targetUrl=BP
718,"Книга музыкальная, 16 страниц. Веселый алфавит",14109612,74,3373,876,Буква-Ленд,20890,10,4,https://www.wildberries.ru/catalog/14109612/detail.aspx?targetUrl=BP
719,Акварельные практики,114883618,38,1678,1040,"Издательство Манн, Иванов и Фербер",4508,2,4,https://www.wildberries.ru/catalog/114883618/detail.aspx?targetUrl=BP
720,Как нарисовать детскую книгу. Девять историй от известных,69067929,30,2028,1419,"Издательство Манн, Иванов и Фербер",4508,9,5,https://www.wildberries.ru/catalog/69067929/detail.aspx?targetUrl=BP
721,Тактильная книга игрушка для детей,76522359,25,1690,1267,Фантазар,518225,134,4,https://www.wildberries.ru/catalog/76522359/detail.aspx?targetUrl=BP
722,Полный годовой набор книг 6+. 12 шт,134636451,56,3372,1483,ШКОЛА СЕМИ ГНОМОВ,25758,26,5,https://www.wildberries.ru/catalog/134636451/detail.aspx?targetUrl=BP
723,Учимся рисовать,2390310,20,1140,912,Издательство АСТ,5971,283,5,https://www.wildberries.ru/catalog/2390310/detail.aspx?targetUrl=BP
724,Алфавит развивающие книги для детей азбука на магнитах,8235415,59,1969,807,"Маэстро, браво!",3714703,17,5,https://www.wildberries.ru/catalog/8235415/detail.aspx?targetUrl=BP
725,История России для детей. Более 1000 рассказов Бутромеев В,140651167,60,2495,998,Филипок и Ко,51143,0,0,https://www.wildberries.ru/catalog/140651167/detail.aspx?targetUrl=BP
726,"Ткачество. Текстиль, аксессуары и предметы декора вручную",70118365,31,2057,1419,"Издательство Манн, Иванов и Фербер",4508,3,5,https://www.wildberries.ru/catalog/70118365/detail.aspx?targetUrl=BP
727,"Развивающие книги для детей, многоразовые детские наклейки",125860862,74,3391,881,МОЗАИКА kids,46666,0,0,https://www.wildberries.ru/catalog/125860862/detail.aspx?targetUrl=BP
728,Набор 6 книг активити. Монтессори,73483037,79,5717,1200,МОЗАИКА kids,46666,2,5,https://www.wildberries.ru/catalog/73483037/detail.aspx?targetUrl=BP
729,Подвижные пазлы Книга с движущимися элементами Дикие зверята,32761897,60,1678,671,НД Плэй,6268,8,4,https://www.wildberries.ru/catalog/32761897/detail.aspx?targetUrl=BP
730,Набор книг для малышей. Полный годовой курс 0+ (12 книг),134587196,56,3372,1483,ШКОЛА СЕМИ ГНОМОВ,25758,26,5,https://www.wildberries.ru/catalog/134587196/detail.aspx?targetUrl=BP
731,Энигмы. Распутай 25 таинственных историй,5906932,36,1085,694,"Издательство Манн, Иванов и Фербер",4508,5,5,https://www.wildberries.ru/catalog/5906932/detail.aspx?targetUrl=BP
732,От 0 до 5 Простые подсказки для умных р,4121903,28,863,621,Альпина. Книги,1373532,7,5,https://www.wildberries.ru/catalog/4121903/detail.aspx?targetUrl=BP
733,Книги для детей подарки детям настольные игры,99822308,63,2490,921,Brainy Bunny,46542,6,5,https://www.wildberries.ru/catalog/99822308/detail.aspx?targetUrl=BP
734,Новогодняя книга-адвент. Волшебный декабрь. Рецепты,106099465,42,1475,855,"Издательство Манн, Иванов и Фербер",4508,3,5,https://www.wildberries.ru/catalog/106099465/detail.aspx?targetUrl=BP
735,Школа пластилина Развитие мелкой моторики и речи Ахмадуллин,140651685,60,2370,948,Домашняя школа 3-6,909203,0,0,https://www.wildberries.ru/catalog/140651685/detail.aspx?targetUrl=BP
736,Ёлка. Семейная игра для новогоднего настроения,19208800,37,4568,2877,"Издательство Манн, Иванов и Фербер",4508,1,5,https://www.wildberries.ru/catalog/19208800/detail.aspx?targetUrl=BP
737,Простое рисование фигура человека. Упражнения для практики,89163153,23,1475,1135,"Издательство Манн, Иванов и Фербер",4508,9,5,https://www.wildberries.ru/catalog/89163153/detail.aspx?targetUrl=BP
738,Набор из 4 настольных игр Игротека 5+,10158022,90,33600,3360,Банда Умников,8804,10,5,https://www.wildberries.ru/catalog/10158022/detail.aspx?targetUrl=BP
739,Набор книг для малышей.Полный годовой курс 3+ (12 книг),134627687,56,3372,1483,ШКОЛА СЕМИ ГНОМОВ,25758,26,5,https://www.wildberries.ru/catalog/134627687/detail.aspx?targetUrl=BP
740,Новогодний набор 2023 подарок 12 в 1,98514184,62,2000,760,БУКВА ЛЕНД,26919,133,5,https://www.wildberries.ru/catalog/98514184/detail.aspx?targetUrl=BP
741,Колесо обозрения. Вокруг света. Интерактивная книга,30628476,30,4062,2843,Лабиринт,67408,5,5,https://www.wildberries.ru/catalog/30628476/detail.aspx?targetUrl=BP
742,Типомания,11593403,30,1260,882,Издательский проект А+А,1309626,2,4,https://www.wildberries.ru/catalog/11593403/detail.aspx?targetUrl=BP
743,Веселые пряталки. В детском саду За городом,30514772,22,900,702,ИД НИГМА,9200,49,5,https://www.wildberries.ru/catalog/30514772/detail.aspx?targetUrl=BP
744,Подарочный набор. Новогоднее чудо. Ёлка Новогодний набор кни…,42645803,73,3960,1069,Издательство CLEVER,4623,10,5,https://www.wildberries.ru/catalog/42645803/detail.aspx?targetUrl=BP
745,Level Up. Твой личный гид в мире компьютерных игр,132761962,43,1338,762,Эксмо,4481,1,5,https://www.wildberries.ru/catalog/132761962/detail.aspx?targetUrl=BP
746,Игра Много-Много Таблица умножения,10533599,90,9300,930,Банда Умников,8804,12,5,https://www.wildberries.ru/catalog/10533599/detail.aspx?targetUrl=BP
747,Набор книг годовой курс для детей 2+,115749431,72,5410,1514,ШКОЛА СЕМИ ГНОМОВ,25758,0,0,https://www.wildberries.ru/catalog/115749431/detail.aspx?targetUrl=BP
748,Классные эксперименты,141999067,60,2470,988,Домашняя школа 10-14,885846,0,0,https://www.wildberries.ru/catalog/141999067/detail.aspx?targetUrl=BP
749,"Свяжи, сложи, повтори",119221364,39,2205,1345,Эксмо,4481,5,5,https://www.wildberries.ru/catalog/119221364/detail.aspx?targetUrl=BP
750,Подвижные картинки. Книга с движущимися элементами В море,32761902,60,1678,671,НД Плэй,6268,23,4,https://www.wildberries.ru/catalog/32761902/detail.aspx?targetUrl=BP
751,Цирк. Набор из 3 книг,4808243,74,2375,617,Издательство CLEVER,4623,4,5,https://www.wildberries.ru/catalog/4808243/detail.aspx?targetUrl=BP
