,Наименование,id,Скидка,Цена,Цена со скидкой,Бренд,id бренда,feedbacks,rating,Ссылка
249,Первые шаги. Давай вырезать! Вкусные задания. KUMON,5720308,23,838,645,"Издательство Манн, Иванов и Фербер",4508,29,5,https://www.wildberries.ru/catalog/5720308/detail.aspx?targetUrl=BP
250,"Многоразовая рабочая тетрадь пиши-стирай,развивающие задания",75364470,60,1520,608,Развитие любимого малыша,1150783,27,5,https://www.wildberries.ru/catalog/75364470/detail.aspx?targetUrl=BP
251,Давай сложим картинки! KUMON,5720245,23,838,645,"Издательство Манн, Иванов и Фербер",4508,24,5,https://www.wildberries.ru/catalog/5720245/detail.aspx?targetUrl=BP
252,Волшебные окошки. Микромир. От 3 лет Книга с окошками,9141010,70,2597,779,Издательство Робинс,8383,62,5,https://www.wildberries.ru/catalog/9141010/detail.aspx?targetUrl=BP
253,Набор книг Minecraft Высокие технологии,43805300,34,1941,1281,Minecraft,4224,15,5,https://www.wildberries.ru/catalog/43805300/detail.aspx?targetUrl=BP
254,Поделки. Развиваем мозг ребенка 3-9 лет Ш. Ахмадуллин,40761475,64,2467,888,Филипок и Ко,51143,91,5,https://www.wildberries.ru/catalog/40761475/detail.aspx?targetUrl=BP
255,Ваш малыш Шаг за шагом Помесячный план развития 2+,124858486,60,2220,888,ИД НЕВА,219394,1,5,https://www.wildberries.ru/catalog/124858486/detail.aspx?targetUrl=BP
256,Фасольки,83328285,5,897,852,Поляндрия,16786,18,5,https://www.wildberries.ru/catalog/83328285/detail.aspx?targetUrl=BP
257,"160 двусторонних мини-карточек Овощи, Фрукты, Дикие животные…",43061242,45,1825,1003,Вундеркинд с пеленок,11013,6,5,https://www.wildberries.ru/catalog/43061242/detail.aspx?targetUrl=BP
258,Для ярких впечатлений,15159205,40,1022,613,Издательство Махаон,6301,25,5,https://www.wildberries.ru/catalog/15159205/detail.aspx?targetUrl=BP
259,Детская энциклопедия для почемучек от 6 до 12 лет,6962784,65,2282,798,Владис,5662,42,5,https://www.wildberries.ru/catalog/6962784/detail.aspx?targetUrl=BP
260,Музыка Играем. Развитие малыша с 6 мес,7958614,67,2825,932,Умница,3078,63,5,https://www.wildberries.ru/catalog/7958614/detail.aspx?targetUrl=BP
261,Волшебные окошки. Как все устроено? От 3 лет. Книга с окошка…,4611067,70,2633,789,Издательство Робинс,8383,79,5,https://www.wildberries.ru/catalog/4611067/detail.aspx?targetUrl=BP
262,Анкета с вопросами для интервью ребенка,35663817,35,2320,1508,Beige Diary,93974,15,5,https://www.wildberries.ru/catalog/35663817/detail.aspx?targetUrl=BP
263,Волшебные окошки Атлас Мира От 3 лет Книга с окошками,9141009,70,2597,779,Издательство Робинс,8383,6,5,https://www.wildberries.ru/catalog/9141009/detail.aspx?targetUrl=BP
264,"ИГРА Обучающая развивающая ""Составляем слова из слогов""",81481285,50,1250,625,Hatber,9008,7,5,https://www.wildberries.ru/catalog/81481285/detail.aspx?targetUrl=BP
265,Анкета с вопросами для интервью ребенка,35663818,35,2320,1508,Beige Diary,93974,15,5,https://www.wildberries.ru/catalog/35663818/detail.aspx?targetUrl=BP
266,Eleeza. Магический реализм Элизы Ивановой. Артбук,68565301,31,2026,1397,Эксмо,4481,8,4,https://www.wildberries.ru/catalog/68565301/detail.aspx?targetUrl=BP
267,"""Раскрашиваем"". Тетрадь KUMON",8196798,6,686,644,"Издательство Манн, Иванов и Фербер",4508,13,4,https://www.wildberries.ru/catalog/8196798/detail.aspx?targetUrl=BP
268,"Карточки ""Чистоговорки"" набор для детей",117638633,39,1050,640,КВАКА,259290,4,5,https://www.wildberries.ru/catalog/117638633/detail.aspx?targetUrl=BP
269,Твоя волшебная сила,39630884,21,1088,859,"Издательство Манн, Иванов и Фербер",4508,11,5,https://www.wildberries.ru/catalog/39630884/detail.aspx?targetUrl=BP
270,Самая умилительная книга квестов,28887702,20,878,702,Издательство АСТ,5971,8,5,https://www.wildberries.ru/catalog/28887702/detail.aspx?targetUrl=BP
271,Цветочная книга шмеля,78458829,19,900,729,Поляндрия,16786,11,5,https://www.wildberries.ru/catalog/78458829/detail.aspx?targetUrl=BP
272,Сборники сказок Сказки-раскраски Раскраски в подарок,26054529,38,1850,1147,Славянские сказки,225896,12,5,https://www.wildberries.ru/catalog/26054529/detail.aspx?targetUrl=BP
273,Есть кто живой Сабитова Ю.В,123078564,30,920,644,Детская литература,24581,264,5,https://www.wildberries.ru/catalog/123078564/detail.aspx?targetUrl=BP
274,Набор Скорочтение 10-16 лет,124197052,60,4995,1998,ИД НЕВА,219394,1,5,https://www.wildberries.ru/catalog/124197052/detail.aspx?targetUrl=BP
275,Асборн - карточки Изучаем звуки с нейропсихологом Игры для д…,52484603,70,2800,840,Издательство Робинс,8383,0,0,https://www.wildberries.ru/catalog/52484603/detail.aspx?targetUrl=BP
276,Развивающие карточки азбука для детей 3+,82670983,46,2230,1204,Развивашки для детей,1167964,21,5,https://www.wildberries.ru/catalog/82670983/detail.aspx?targetUrl=BP
277,100 Игр. Развивающие игры для детей 5+,3710477,68,2509,802,Умница,3078,334,5,https://www.wildberries.ru/catalog/3710477/detail.aspx?targetUrl=BP
278,"Тетрадь ""Пиши-стирай"" прописи для малышей пиши стирай Развив…",67954026,40,1100,660,Три_Хвоста,171469,9,4,https://www.wildberries.ru/catalog/67954026/detail.aspx?targetUrl=BP
279,"Маркеры! Все о цвете, материалах и скетчах",114404592,30,902,631,Эксмо,4481,22,5,https://www.wildberries.ru/catalog/114404592/detail.aspx?targetUrl=BP
280,Книжный конструктор. Для самых маленьких. От 1 года,7057821,51,1214,594,Издательство Робинс,8383,23,5,https://www.wildberries.ru/catalog/7057821/detail.aspx?targetUrl=BP
281,Комплект Обучение чтению и письму Букварь-тренажер,132522913,60,3720,1488,Домашняя школа 6-9,893873,0,0,https://www.wildberries.ru/catalog/132522913/detail.aspx?targetUrl=BP
282,Фараоны. Загадочный мир прошлого. Книга-панорама,30628266,21,2531,1999,Лабиринт,67408,0,0,https://www.wildberries.ru/catalog/30628266/detail.aspx?targetUrl=BP
283,Подарок для тебя,67212368,52,1190,571,Поляндрия Принт,314114,12,5,https://www.wildberries.ru/catalog/67212368/detail.aspx?targetUrl=BP
284,Большой подарок для самых маленьких. 15,16595800,20,1965,1572,Издательство АСТ,5971,9,5,https://www.wildberries.ru/catalog/16595800/detail.aspx?targetUrl=BP
285,Приключения Чиполлино (ил. К. Бальони),11869419,16,1019,855,Эксмо,4481,12,5,https://www.wildberries.ru/catalog/11869419/detail.aspx?targetUrl=BP
286,Детская энциклопедия. Лошади мира. Книги для детей,10924102,74,2352,611,Владис,5662,44,5,https://www.wildberries.ru/catalog/10924102/detail.aspx?targetUrl=BP
287,Книжный кубик. Сказочный кубик,16306726,70,2263,678,Издательство Робинс,8383,28,5,https://www.wildberries.ru/catalog/16306726/detail.aspx?targetUrl=BP
288,Вышиваем елочные игрушки. 27 схем. Горкальцева Яна,6581874,35,1300,845,Хоббитека,8101,59,5,https://www.wildberries.ru/catalog/6581874/detail.aspx?targetUrl=BP
289,Индейские мандалы. Фенина Анна,4619909,35,900,585,Хоббитека,8101,16,5,https://www.wildberries.ru/catalog/4619909/detail.aspx?targetUrl=BP
290,Асборн - карточки Изучаем буквы с нейропсихологом Игры для д…,52479092,70,2683,804,Издательство Робинс,8383,3,4,https://www.wildberries.ru/catalog/52479092/detail.aspx?targetUrl=BP
291,Новая энциклопедия для дошколят и младших школьников,6888623,79,3287,690,Владис,5662,75,5,https://www.wildberries.ru/catalog/6888623/detail.aspx?targetUrl=BP
292,Нейропрописи. Нейротренажер для детей,44874686,30,929,650,Детство в КУБЕ,1283613,18,5,https://www.wildberries.ru/catalog/44874686/detail.aspx?targetUrl=BP
293,Книга 40 хадисов о нравственности,28223998,37,950,598,АЛИФ,83231,42,5,https://www.wildberries.ru/catalog/28223998/detail.aspx?targetUrl=BP
294,Японское суперобъемное оригами. Уникальный способ прокачать,83953203,27,1415,1032,Эксмо,4481,6,4,https://www.wildberries.ru/catalog/83953203/detail.aspx?targetUrl=BP
295,Зверопутаницы. Подарочный набор,18401266,70,2283,684,Издательство Робинс,8383,20,5,https://www.wildberries.ru/catalog/18401266/detail.aspx?targetUrl=BP
296,Леонардо да Винчи и его Вселенная,125913712,32,1207,820,"Издательство Манн, Иванов и Фербер",4508,2,5,https://www.wildberries.ru/catalog/125913712/detail.aspx?targetUrl=BP
297,Что? Кто? Когда? Почему? Динозавры. Книги для детей,4162125,74,2968,771,Владис,5662,188,5,https://www.wildberries.ru/catalog/4162125/detail.aspx?targetUrl=BP
298,Развивающая рабочая тетрадь пиши стирай с 4 лет Развивашки,23181135,69,2390,740,umka.baby,124844,11,5,https://www.wildberries.ru/catalog/23181135/detail.aspx?targetUrl=BP
299,Мой первый альбом с большими наклейками. От 3 лет,3798079,70,2147,644,Издательство Робинс,8383,18,5,https://www.wildberries.ru/catalog/3798079/detail.aspx?targetUrl=BP
300,Невероятные приключения лесной феи и её,18893997,20,803,642,Издательство АСТ,5971,8,5,https://www.wildberries.ru/catalog/18893997/detail.aspx?targetUrl=BP
301,Вопросы и ответы о твоем теле. От 3 лет. Книга с окошками,2948946,70,2983,894,Издательство Робинс,8383,35,5,https://www.wildberries.ru/catalog/2948946/detail.aspx?targetUrl=BP
302,Волшебные окошки Водный мир От 3 лет Книга с окошками,13823097,70,2597,779,Издательство Робинс,8383,14,5,https://www.wildberries.ru/catalog/13823097/detail.aspx?targetUrl=BP
303,"Детская энциклопедия техники, изобретений и открытий",10924156,79,2769,581,Владис,5662,64,5,https://www.wildberries.ru/catalog/10924156/detail.aspx?targetUrl=BP
304,Книга тетрадь игра прописи для малышей,111564141,82,3394,610,Нескучное детство,396357,23,5,https://www.wildberries.ru/catalog/111564141/detail.aspx?targetUrl=BP
305,Детская текстильная кукла в вальдорфском стиле,4619908,35,1100,715,Хоббитека,8101,27,4,https://www.wildberries.ru/catalog/4619908/detail.aspx?targetUrl=BP
306,Большая книга цифр Игровая книга для изучения чисел и цифр д…,60641647,75,2756,689,Издательство Робинс,8383,1,5,https://www.wildberries.ru/catalog/60641647/detail.aspx?targetUrl=BP
307,Дневник супервоина. Настоящий герой! Книга 2,5893479,15,869,738,Эксмо,4481,52,5,https://www.wildberries.ru/catalog/5893479/detail.aspx?targetUrl=BP
308,Поделки. Развиваем мозг ребенка 3-9 лет Ш. Ахмадуллин,61359634,64,2467,888,Домашняя школа 6-9,893873,8,5,https://www.wildberries.ru/catalog/61359634/detail.aspx?targetUrl=BP
309,Маффин и его весёлые друзья (ил. Н,67934984,20,1043,834,Издательство АСТ,5971,5,5,https://www.wildberries.ru/catalog/67934984/detail.aspx?targetUrl=BP
310,Давай сложим картинки! Весёлые истории. KUMON Рабочая тетрад…,12462835,19,798,646,"Издательство Манн, Иванов и Фербер",4508,6,5,https://www.wildberries.ru/catalog/12462835/detail.aspx?targetUrl=BP
311,Великие первооткрыватели. От походов за сокровищами до,11869467,17,1787,1483,"Издательство Манн, Иванов и Фербер",4508,4,5,https://www.wildberries.ru/catalog/11869467/detail.aspx?targetUrl=BP
312,Киндерномика. Что такое деньги и как с ними обращаться?,18637273,25,1252,939,Эксмо,4481,16,5,https://www.wildberries.ru/catalog/18637273/detail.aspx?targetUrl=BP
313,Тетрадь пиши стирай рабочая для детей 3-5 лет многоразовая,13061768,30,1279,895,Мама мышка,41341,666,5,https://www.wildberries.ru/catalog/13061768/detail.aspx?targetUrl=BP
314,Набор Скорочтение для детей 6 - 9 лет,123351833,60,4970,1988,КАПИТАЛ,18716,1,4,https://www.wildberries.ru/catalog/123351833/detail.aspx?targetUrl=BP
315,Гравити Фолз. Энциклопедия фаната,45760611,33,945,633,Эксмо,4481,8,5,https://www.wildberries.ru/catalog/45760611/detail.aspx?targetUrl=BP
316,Пазлы Учимся читать по слогам NEW Развивающая игра От 3 лет,57830866,70,1963,588,Издательство Робинс,8383,5,5,https://www.wildberries.ru/catalog/57830866/detail.aspx?targetUrl=BP
317,Рисование и лепка для детей от 2 до 3 лет (+ карточки),5789739,26,1029,761,Эксмо,4481,48,5,https://www.wildberries.ru/catalog/5789739/detail.aspx?targetUrl=BP
318,Многоразовые развивающие карточки для детей малышей Лепка,39683740,50,1600,800,Улитка Пирамидка,470164,36,5,https://www.wildberries.ru/catalog/39683740/detail.aspx?targetUrl=BP
319,Книга Намаз Моё первое поклонение,28224009,44,1130,632,АЛИФ,83231,32,5,https://www.wildberries.ru/catalog/28224009/detail.aspx?targetUrl=BP
320,Книга Истории пророков юным читателям,26414042,38,1590,985,Рисаля,83229,22,5,https://www.wildberries.ru/catalog/26414042/detail.aspx?targetUrl=BP
321,1000 логических игр и головоломок для,4126667,20,1380,1104,Издательство АСТ,5971,10,5,https://www.wildberries.ru/catalog/4126667/detail.aspx?targetUrl=BP
322,Моя первая азбука. От 1 года,8777420,70,2783,834,Издательство Робинс,8383,17,4,https://www.wildberries.ru/catalog/8777420/detail.aspx?targetUrl=BP
323,Мой первый альбом с самыми большими наклейками. От 1 года,4941752,70,2147,644,Издательство Робинс,8383,56,5,https://www.wildberries.ru/catalog/4941752/detail.aspx?targetUrl=BP
324,Асборн - карточки Мои первые развивающие карточки,6078101,70,2563,768,Издательство Робинс,8383,112,5,https://www.wildberries.ru/catalog/6078101/detail.aspx?targetUrl=BP
325,Пространственные головоломки 6-8 лет,26817482,90,15900,1590,Банда Умников,8804,3,4,https://www.wildberries.ru/catalog/26817482/detail.aspx?targetUrl=BP
326,Пазлы Учимся читать по слогам Новые слова NEW Развивающая иг…,57838311,70,1963,588,Издательство Робинс,8383,1,5,https://www.wildberries.ru/catalog/57838311/detail.aspx?targetUrl=BP
327,Хочу красивый интерьер,124122528,33,2084,1396,"Издательство Манн, Иванов и Фербер",4508,1,3,https://www.wildberries.ru/catalog/124122528/detail.aspx?targetUrl=BP
328,Книга с наклейками Ninjago 1001 Наклейка,11259337,3,787,763,LEGO,1241,19,5,https://www.wildberries.ru/catalog/11259337/detail.aspx?targetUrl=BP
329,Шьем елочные игрушки. Фольклорная коллекция,3473437,32,1180,802,Хоббитека,8101,20,5,https://www.wildberries.ru/catalog/3473437/detail.aspx?targetUrl=BP
330,Капитан Немо,69178071,59,1755,719,Поляндрия,16786,2,3,https://www.wildberries.ru/catalog/69178071/detail.aspx?targetUrl=BP
331,Пирогометрия,44483114,25,1884,1413,"Издательство Манн, Иванов и Фербер",4508,1,1,https://www.wildberries.ru/catalog/44483114/detail.aspx?targetUrl=BP
332,Тимоти Скотт. Если в домике тесно. Компл,52619189,65,2984,1044,Машины Творения,9197,36,5,https://www.wildberries.ru/catalog/52619189/detail.aspx?targetUrl=BP
333,Хранитель луны,67251700,50,1313,656,Поляндрия,16786,10,4,https://www.wildberries.ru/catalog/67251700/detail.aspx?targetUrl=BP
334,Суперраскладушки Развиваем малыша от 1года до 3 лет 3 книжки…,87458921,70,2997,899,Издательство Робинс,8383,4,5,https://www.wildberries.ru/catalog/87458921/detail.aspx?targetUrl=BP
335,Книга 40 хадисов нравственности 2 часть,28223960,18,720,590,АЛИФ,83231,26,5,https://www.wildberries.ru/catalog/28223960/detail.aspx?targetUrl=BP
336,Асборн - карточки Нескучные лабиринты для тренировки мозга Р…,14233988,70,1950,585,Издательство Робинс,8383,7,5,https://www.wildberries.ru/catalog/14233988/detail.aspx?targetUrl=BP
337,Динозавры и доисторические животные. Книги для детей,10924107,71,2480,719,Владис,5662,43,5,https://www.wildberries.ru/catalog/10924107/detail.aspx?targetUrl=BP
338,"Обучающие карточки для детей Овощи, фрукты, ягоды",10276035,66,1800,612,Проф-Пресс,6343,47,5,https://www.wildberries.ru/catalog/10276035/detail.aspx?targetUrl=BP
339,Чемпионат мира по головоломкам,11304078,23,820,631,Эксмо,4481,5,5,https://www.wildberries.ru/catalog/11304078/detail.aspx?targetUrl=BP
340,Асборн - карточки 100 логических игр для путешествий Игры дл…,2948940,70,1950,585,Издательство Робинс,8383,35,5,https://www.wildberries.ru/catalog/2948940/detail.aspx?targetUrl=BP
341,Эпические базы. Строим вместе,16597543,50,1200,600,Minecraft,4224,24,5,https://www.wildberries.ru/catalog/16597543/detail.aspx?targetUrl=BP
342,С Новым годом! Большая книга-адвент с окошками,119442059,31,2624,1810,"Издательство Манн, Иванов и Фербер",4508,13,4,https://www.wildberries.ru/catalog/119442059/detail.aspx?targetUrl=BP
343,Книги для детей 5 лет 6 лет 7 лет игры,92208206,67,1874,618,Детское царство,303050,9,5,https://www.wildberries.ru/catalog/92208206/detail.aspx?targetUrl=BP
344,Мастерская МАГИИ Гарри Поттера,137055003,0,2869,2869,Эксмо,4481,0,0,https://www.wildberries.ru/catalog/137055003/detail.aspx?targetUrl=BP
345,Детская иллюстрированная энциклопедия в вопросах и ответах,22949952,68,2539,812,Владис,5662,29,5,https://www.wildberries.ru/catalog/22949952/detail.aspx?targetUrl=BP
346,Блокнот тетрадь рабочая книга пиши стирай для детей 2-4 лет,13061773,30,1236,865,Мама мышка,41341,666,5,https://www.wildberries.ru/catalog/13061773/detail.aspx?targetUrl=BP
347,Когда за окном метель. Уютная семейная книга для,47588329,24,996,756,Эксмо,4481,6,5,https://www.wildberries.ru/catalog/47588329/detail.aspx?targetUrl=BP
348,Все о Кролике Питере (рисунки Беатрис Поттер),14860501,20,1313,1050,Издательство АСТ,5971,27,4,https://www.wildberries.ru/catalog/14860501/detail.aspx?targetUrl=BP
349,Комплект первых прописей для детей,36923717,60,1570,628,Станюк Т.Ю.,231422,14,5,https://www.wildberries.ru/catalog/36923717/detail.aspx?targetUrl=BP
350,Настольная игра Съедобное-несъедобное детские лото викторина,21478890,35,1216,790,BONDIBON,9584,0,0,https://www.wildberries.ru/catalog/21478890/detail.aspx?targetUrl=BP
351,Набор Скорочтение 10-16 лет,123356501,60,4970,1988,КАПИТАЛ,18716,0,0,https://www.wildberries.ru/catalog/123356501/detail.aspx?targetUrl=BP
352,Большая книга пошагового рисования,55895046,65,1900,665,Проф-Пресс,6343,10,5,https://www.wildberries.ru/catalog/55895046/detail.aspx?targetUrl=BP
353,Книга детская Белочка Фатиха,28223997,55,1500,675,АЛИФ,83231,1,5,https://www.wildberries.ru/catalog/28223997/detail.aspx?targetUrl=BP
354,Настольная игра Дом Весёлая викторина подарок для детей,10237598,31,927,639,BONDIBON,9584,10,5,https://www.wildberries.ru/catalog/10237598/detail.aspx?targetUrl=BP
355,Коллекция японских узоров Йоко Хатты. 200 стильных дизайнов,11385353,19,1933,1565,"Издательство Манн, Иванов и Фербер",4508,16,4,https://www.wildberries.ru/catalog/11385353/detail.aspx?targetUrl=BP
356,Книжный кубик. Азбука,16520464,70,2263,678,Издательство Робинс,8383,4,5,https://www.wildberries.ru/catalog/16520464/detail.aspx?targetUrl=BP
357,Старик Хоттабыч Лагин Л.И. Издательство Детская дитература,106271231,30,1076,753,Детская литература,24581,135,5,https://www.wildberries.ru/catalog/106271231/detail.aspx?targetUrl=BP
358,ПРИНЦЕССА НА ГОРОШИНЕ Ганс Христиан Андерсен илл Дузиковой,7963949,50,1500,750,Добрая книга,9184,9,4,https://www.wildberries.ru/catalog/7963949/detail.aspx?targetUrl=BP
359,Наука не скука 6+,6220566,37,1102,694,ПИТЕР,6412,47,5,https://www.wildberries.ru/catalog/6220566/detail.aspx?targetUrl=BP
360,Изучаем звуки и буквы с нейропсихологом Книга для детей от 3…,79863104,70,2230,669,Издательство Робинс,8383,1,5,https://www.wildberries.ru/catalog/79863104/detail.aspx?targetUrl=BP
361,Сказки своими руками. Истории с пушистым хвостом,91860651,37,1088,685,ПИТЕР,6412,1,5,https://www.wildberries.ru/catalog/91860651/detail.aspx?targetUrl=BP
362,Тетрадь А4 книга пиши стирай рабочая Лабиринты многоразовая,13061770,30,1279,895,Мама мышка,41341,666,5,https://www.wildberries.ru/catalog/13061770/detail.aspx?targetUrl=BP
363,160 развивающих игр,7902885,20,863,690,Альпина. Книги,1373532,20,4,https://www.wildberries.ru/catalog/7902885/detail.aspx?targetUrl=BP
364,Авто и Технопутаница. Подарочный набор,18401265,70,2383,714,Издательство Робинс,8383,21,5,https://www.wildberries.ru/catalog/18401265/detail.aspx?targetUrl=BP
365,Океаны и моря. Виртуальная реальность,46583911,22,811,632,Эксмо,4481,0,0,https://www.wildberries.ru/catalog/46583911/detail.aspx?targetUrl=BP
366,Развивающие наклейки. В зоопарке. KUMON,5720262,21,915,722,"Издательство Манн, Иванов и Фербер",4508,18,4,https://www.wildberries.ru/catalog/5720262/detail.aspx?targetUrl=BP
367,Я любила тебя всегда,11433977,35,955,620,Издательство Гудвин,1215229,14,4,https://www.wildberries.ru/catalog/11433977/detail.aspx?targetUrl=BP
368,"Книга ""Скорочтение для детей 10 - 16 л.""",124869226,60,2220,888,ИД НЕВА,219394,1,5,https://www.wildberries.ru/catalog/124869226/detail.aspx?targetUrl=BP
369,"Привет, это мы! Фотоальбом (для близнец",4816856,40,2552,1531,Издательство Махаон,6301,54,4,https://www.wildberries.ru/catalog/4816856/detail.aspx?targetUrl=BP
370,Игра Угадай столицу флаги мира деревянные фишки,137814006,30,999,699,Мастер Игрушек,32834,0,0,https://www.wildberries.ru/catalog/137814006/detail.aspx?targetUrl=BP
